{"question": "מהו מצבו התפקודי העדכני של המבוטח?", "answer": "המבוטח עדיין סובל מכאבים ומגבלה תפקודית (22/07/2025). סיכום טיפול: \"כאבים: דרוג בעת דרוג בעת ΣT איבר סגירת הסידרה פתיחת הסידרה 7 שמאל כף יד הערכת מטפל: 2-שיפור חלקי הערות: לדבריו עדיין כאבים כף יד שמאל במיוחד בחזקת חפצים והרמת חפצים יותר מ1 ק\"ג הגבלה בסוף האגרוף במיוחד בסג\"", "contexts": ["פעולות בעבר: INTERNAL FIXATION BASE MTC 5 LT HAND מחלה נוכחית: בן 58, ברקע סוכרת, תחת טיפול במיקרופירין. ללא עבר ניתוחי. מוכר לנו מפניה קודמת למיון אשר נבדק בשל חבלת כף יד שמאל בזמן עבודה, השלים צלום רנטגן אשר הודגם שבר בסיס מסרק 5 עם תזוזה . טופל ע\"י סד גבס, בדיון מחלקתי הוחלט על טיפול ניתוחי. . כעת פנה לצורך טיפול. מהלך האשפוז ודיון: בתאריך 29/01/2025 עבר ניתוח שחזור סגור וקיבוע שבר ע\"י K-WIRE. הקיבוע הוצא. צילומי רנטגן - מחובר טוב לחזור לפעילות מלאה, ללא הגבלה, בהדרגה. להתחיל דחוף טיפולי ר י פוי בעיסוק ופיזיותרפיה. ביקורת כאן בעוד חודש. מנוחה מעבודה עוד חודש מהיום. רופא ד\"ר עוזר יורם מ.ר. 18656 חתימה: רופא בכיר ד\"ר עוזר יורם מ.ר. 18656 חתימה: תאריך ושעת הדפסת הדוח: 07/03/2025 09:28:14", "מאהל כתובת תעודה רפואית נוספת לנפגע בעבודה מרפאה :נין: 58.02 7 גיל: 00023131840 מס זהות: פרטי המטופל: חביבאללה סאמי ת.ד. 1090 שם משפחה ופרטי: רחוב: 52 - 5767209 עין מאהל טלפון נוסף: ישוב: 11:30 14/05/1967 שעת תאונה: 53 - 2335801 ת.לידה: מאריך תאונה: 21/01/2025 טלפון: 0 מס בית: 2 תאונת עבודה סוג תאונה: ד\"ר האיל חטיב שם הרופא המטפל: ממצאים מתאריך 21/04/2025: ממצאים מתאריך 18/03/2025: הממצאים הקליניים: ממצאים מתאריך 08/03/2025: ממצאים מתאריך 27/02/2025: ממצאים מתאריך 03/02/2025: ממצאים מתאריך 30/01/2025: ממצאים מתאריך 21/01/2025: כף יד שמאל עם נפיחות דיפוזית ורגישטת במישוש :21/04/2025 לדבריו היום טרם פנייתו נפ ונחבל בכף יד שמאל וימין, שולל חבלת ראש, שולל חבלות אחרות נבדק במיון לאחר שהחליק בעבודה ממשאית הודגם שבר בסיס מסרק 5 טופל בסד גבס בהמשך עבר ניתוח שחזור סגור וקיבוע ע\"י - K-WIRE) עם תזוזה שוחרר עם המלצות מעקב 03/02/2025: 27/02/2025: כאבים בכף יד שמאלי עדיין עם גבס טרם יש תור לאורתופיד ביקורת מאתמול מרפאה אורטפדית- בוצע הורדת גבס שוחרר עם המלצה בפיזיוטרפיה וריפוי בעיסוק בהקדם FRACTURE METACARPALS CLOSED אבחנות אבחנה איפיון קוד 8150 הטיפול הנוכחי: כתוצאה מהפגיעה המוצהרת ע\"י הנ\"ל: אינו/ה מסוגל/ת לעסוק בעבודתו/ה ואף לא בעבודה אחרת סה\"כ 64 ימים ۲ (בכלל) עד יום 23/06/2025 מיום 21/04/2025 197 ***המסמך מכיל מידע מוגן על-פי חוק הגנת הפרטיות*** 29/06/2025 תעודה רפואית נוספת לנפגע בעבודה הודפס ע\"י ד\"ר האיל ח'טיב 00023131840 חריבאללה סאמי", "אריך כתובת תעודה רפואית נוספת לנפגע בעבודה מרפאה :נין: 58.02 T :גיל 00023131840 מס זהות: פרטי המטופל: חביבאללה סאמי п.т. 0901 שם משפחה ופרטי: רחוב: עין מאהל 52 - 5767209 ישוב: טלפון נוסף: 14/05/1967 11:30 ת.לידה: 53 - 2335801 שעת תאונה: טלפון: מאריך תאונה: 21/01/2025 0 מס בית: 2 תאונת עבודה סוג תאונה: ד\"ר האיל חטיב שם הרופא המטפל: ממצאים מתאריך 21/04/2025: הממצאים הקליניים: ממצאים מתאריך 18/03/2025: ממצאים מתאריך 08/03/2025: ממצאים מתאריך 27/02/2025: ממצאים מתאריך 03/02/2025: :30/01/2025 ממצאים מתאריך ממצאים מתאריך 21/01/2025: כף יד שמאל עם נפיחות דיפוזית ורגישטת במישוש :21/04/2025 לדבריו היום טרם פנייתו נפ ונחבל בכף יד שמאל וימין, שולל חבלת ראש, שולל חבלות אחרות נבדק במיון לאחר שהחליק בעבודה ממשאית הודגם שבר בסיס מסרק 5 30/01/2025: טופל בסד גבס בהמשך עבר ניתוח שחזור סגור וקיבוע ע\"י - K-WIRE) שוחרר עם המלצות מעקב 03/02/2025: 27/02/2025: כאבים בכף יד שמאלי עדיין עם גבס טרם יש תור לאורתופיד 08/03/2025: ביקורת מאתמול מרפאה אורטפדית- בוצע הורדת גבס שוחרר עם המלצה בפיזיוטרפיה וריפוי בעיסוק בהקדם אבחנות FRACTURE METACARPALS CLOSED אבחנה איפיון קוד 8150 הטיפול הנוכחי: כתוצאה מהפגיעה המוצהרת ע\"י הנ\"ל: אינו/ה מסוגל/ת לעסוק בעבודתו/ה ואף לא בעבודה אחרת ٥ סה\"כ 64 ימים (בכלל) עד יום 23/06/2025 מיום 21/04/2025 197 ***המסמך מכיל מידע מוגן על-פי חוק הגנת הפרטיות*** תעודה רפואית נוספת לנפגע בעבודה 29/06/2025 הודפס ע\"י ד\"ר האיל ח'טיב 00023131840 חביבאללה סאמי", "אריך כתובת תעודה רפואית נוספת לנפגע בעבודה מרפאה :נין: 58.02 T :גיל 00023131840 מס זהות: פרטי המטופל: חביבאללה סאמי п.т. 0901 שם משפחה ופרטי: רחוב: עין מאהל 52 - 5767209 ישוב: טלפון נוסף: 14/05/1967 11:30 ת.לידה: 53 - 2335801 שעת תאונה: טלפון: מאריך תאונה: 21/01/2025 0 מס בית: 2 תאונת עבודה סוג תאונה: ד\"ר האיל חטיב שם הרופא המטפל: ממצאים מתאריך 21/04/2025: הממצאים הקליניים: ממצאים מתאריך 18/03/2025: ממצאים מתאריך 08/03/2025: ממצאים מתאריך 27/02/2025: ממצאים מתאריך 03/02/2025: :30/01/2025 ממצאים מתאריך ממצאים מתאריך 21/01/2025: כף יד שמאל עם נפיחות דיפוזית ורגישטת במישוש :21/04/2025 לדבריו היום טרם פנייתו נפ ונחבל בכף יד שמאל וימין, שולל חבלת ראש, שולל חבלות אחרות נבדק במיון לאחר שהחליק בעבודה ממשאית הודגם שבר בסיס מסרק 5 30/01/2025: טופל בסד גבס בהמשך עבר ניתוח שחזור סגור וקיבוע ע\"י - K-WIRE) שוחרר עם המלצות מעקב 03/02/2025: 27/02/2025: כאבים בכף יד שמאלי עדיין עם גבס טרם יש תור לאורתופיד 08/03/2025: ביקורת מאתמול מרפאה אורטפדית- בוצע הורדת גבס שוחרר עם המלצה בפיזיוטרפיה וריפוי בעיסוק בהקדם אבחנות FRACTURE METACARPALS CLOSED אבחנה איפיון קוד 8150 הטיפול הנוכחי: כתוצאה מהפגיעה המוצהרת ע\"י הנ\"ל: אינו/ה מסוגל/ת לעסוק בעבודתו/ה ואף לא בעבודה אחרת ٥ סה\"כ 64 ימים (בכלל) עד יום 23/06/2025 מיום 21/04/2025 197 ***המסמך מכיל מידע מוגן על-פי חוק הגנת הפרטיות*** תעודה רפואית נוספת לנפגע בעבודה 29/06/2025 הודפס ע\"י ד\"ר האיל ח'טיב 00023131840 חביבאללה סאמי", "יך תאונה: 21/01/2025 הממצאים הקליניים: עובד כנהג משאית לדבריו היום טרם פנייתו נפ ונחבל בכף יד שמאל וימין, שולל חבלת ראש. שולל חבלות אחרות :30/01/2025 נבדק במיון לאחר שהחליק בעבודה ממשאית הודגם שבר בסיס מסרק 5 עם תזוזה טופל בסד גבס בהמשך עבר ניתוח שחזור סגור וקיבוע ע\"י -K-WIRE וגבס שוחרר עם המלצות מעקב :03/02/2025 :27/02/2025 כאבים בכף יד שמאלי עדיין עם גבס טרם יש תור לאורתופיד :08/03/2025 ביקורת מאתמול מרפאה אורטפדית- בוצע הורדת גבס שוחרר עם המלצה בפיזיוטרפיה וריפוי בעיסוק בהקדם הוסבר למטופל על צורך בפעילות מלאה, ללא הגבלה נחנות 기교 איפיון אבחנה 815 FRACTURE METACARPALS CLOSED ויפול הנוכחי: וצאה מהפגיעה המוצהרת ע\"י הנ\"ל: אינו/ה מסוגל/ת לעסוון בעבודתו/ה ואף לא בעבודה אחרת מיום 21/03/2025 מיום עד יום 21/04/2025 עד (בכלל) סה\"כ 32 ימים 18/03/2025 18/03/2025 תאריך מתן התעודה ת.", "58.02 00-02313184-0 т חביבאללה סאמי שם האב ת.לידה גיל מין מס זהות שם משפחה ושם פרטי 53 -2335801 52 - 5767209 0 1090 ... 1 עין מאהל טלפון נוסף טלפון מס בית רחוב ישוב מספר זיהוי הפניה: 36132004128 מס' הפניה במכון הפיזיותרפיה: 250549976 תאריך הפניה: 08/03/2025 סוג הביקורים לסדרה: 2 תאונת עבודה רשיון רופא: 132528 לכבוד הרופא המטפל/מקצועי: ד\"ר ח'אלד ח'טיב מרפאה: 6132 מקצוע: רופא כללי אבחנה בהפניה: אבחנה איפיון ΣT קוד FRACTURE METACARPALS CLOSED 8150 אבחנה לטיפול: אבחנה YT קוד FRACTURE METACARPALS OPEN 8151 שמאל תאריך תחילת טיפול: 18/03/2025 פרטני: 17 מס' ביקורים בפועל: 17 מס' אי הופעות לטיפול: רשימת כל הטיפולים: טיפול כמות 1 אבחון ראשון- בדיקה של פיזיותרפיסט 17 הדרכה וייעוץ (לאורח חיים בריא) 17 תרגול כללי 17 טיפול באמבטיה מערבולת 17 טיפול בפרפין 17 הדרכה לתרגול בבית דף 1 מ 2 ***המסמך מכיל מידע מוגן על-פי חוק הגנת הפרטיות סיכום טיפול 22/07/2025 הודפס ע\"י גיהאד עונאללה 00-02313184-0 חביבאללה סאמי כאבים: דרוג בעת דרוג בעת ΣT איבר סגירת הסידרה פתיחת הסידרה 7 שמאל כף יד הערכת מטפל: 2-שיפור חלקי הערות: לדבריו עדיין כאבים כף יד שמאל במיוחד בחזקת חפצים והרמת חפצים יותר מ1 ק\"ג הגבלה בסוף האגרוף במיוחד בסגירת הזרת השמאלית 22/07/2025 המטופל ביקר במכון בתאריכים: 21/07/2025 15/07/2025 08/07/2025 01/07/2025 26/06/2025 20/05/2025 12/05/2025 05/05/2025 28/04/2025 22/04/2025 18/04/2025 15/04/2025 27/03/2025 1.0 25/03/2025 20/03/2025 ٠ 18/03/2025 5 BIC גיהאד עונאללה חתימה וחותמת שם מטפל ***המסמך מכיל"], "ground_truths": ["המבוטח עדיין סובל מכאבים ומגבלה תפקודית (22/07/2025). סיכום טיפול: \"כאבים: דרוג בעת דרוג בעת ΣT איבר סגירת הסידרה פתיחת הסידרה 7 שמאל כף יד הערכת מטפל: 2-שיפור חלקי הערות: לדבריו עדיין כאבים כף יד שמאל במיוחד בחזקת חפצים והרמת חפצים יותר מ1 ק\"ג הגבלה בסוף האגרוף במיוחד בסג\""]}
{"question": "מהי המלצת הרופא התעסוקתי לגבי חזרה לעבודה?", "answer": "אינו יכול לחזור לעבודה עד 20/09/2025 (20/09/2025). טופס סיכום בדיקה רפואית: \"לחזור עדיין לעבודתו ויש לאשר המשך חופש מחלה נמצא כי הנ\"ל: עד תאריך 20/09/2025 מתאריך 23/06/2025 תוקף המגבלה: יש לשוב לביקורת במרפאתנו בתום התקופה הרש\"", "contexts": ["האב פרטי העובד ת.לידה מין חביבאללה סאמי גיל 52 - 5767209 מס זהות שם משפחה ושם פרטי 53 2335801 . טלפון נוסף 0 טלפון ת.ד. 1090 מס בית עין מאהל רחוב נהג ישוב מובילי דרור (מ.נ) שותפות מוגבלת מקצוע מקום עבודה מגדל העמק כתובת מקום עבודה פרטי מעסיק כתובת מעסיק טופס סיכום בדיקה רפואית לכבוד רופא/ת משפחה ד\"ר חטיב לשם בדיקת כושר עבודה אדון/גברת נכבד/ה, על סמך בדיקה רפואית מקוונת שנערכה נהג בתור 23/06/2025 לפי תוצאות ומסקנות הבדיקה הרפואית מיום וגם לאחר עיון במסמכים רפואיים עדכניים שעמדו לרשותי אינו יכול לחזור עדיין לעבודתו ויש לאשר המשך חופש מחלה נמצא כי הנ\"ל: עד תאריך 20/09/2025 מתאריך 23/06/2025 תוקף המגבלה: יש לשוב לביקורת במרפאתנו בתום התקופה הרשומה לעיל 019210 דייף יונקובוחמאיך אותה הרופא ד\"ר ראובן מרקוס יעקובוביץ מס' רישיון מומהח ברפואה תעסוקתית שם רופא 15490 ...... 19210 .....", "מאת:אשרף מטר נשלח:13:14:03 21/04/2025 נשלח אל:תביעות בריאות; יישוב תביעות בטוח חיים אל:תביעות בריאות; יישוב תביעות בטוח חיים עותק: נושא:המשך איושרי מחלה עבור תביעה 96981631 ביעה אי כושר עבודה סאמי חביב אללה ת.ז 023131840 אזהרה: מייל זה התקבל ממקור חיצוני, יש לשים לב ללינקים ו∕או קבצים מצורפים. שלום, מצ\"ב, 023131840 תביעה 203131840 תביעה אי כושר עבודה סאמי חביב אללה ת.ז Mail System SGS H.", "מאת:אשרף מטר נשלח:43:54 25/02/2025 11:43 אל:תביעות בריאות – תיוק בלבד; מייל תביעות בריאות; יישוב תביעות בטוח חיים; סוכן תביעות בריאות עותק: נושא:חומר לפתיחת תביעה אי כושר עבודה סאמי חביב אללה ת.ז 023131840 אזהרה: מייל זה התקבל ממקור חיצוני, יש לשים לב ללינקים ו∕או קבצים מצורפים. שלום, מצ\"ב, חומר לפתיחת תביעה אי כושר עבודה סאמי חביב אללה ת.ז 023131840 Mail System SGS H."], "ground_truths": ["אינו יכול לחזור לעבודה עד 20/09/2025 (20/09/2025). טופס סיכום בדיקה רפואית: \"לחזור עדיין לעבודתו ויש לאשר המשך חופש מחלה נמצא כי הנ\"ל: עד תאריך 20/09/2025 מתאריך 23/06/2025 תוקף המגבלה: יש לשוב לביקורת במרפאתנו בתום התקופה הרש\""]}
{"question": "האם יש אישור מחלה בתוקף?", "answer": "לא נמצא אישור מחלה בתוקף.", "contexts": [], "ground_truths": ["לא נמצא אישור מחלה בתוקף."]}
